{
  "schema_version": "1.0",
  "token_id": "cid:it_token_sha256_001",
  "token_type": "transferable_knowledge",
  "created_at": "2025-12-24T00:00:00.000Z",
  "title": "Recommendations for Establishing ITs + Object Store/Vector Store Capabilities for Attribution & Compensation (Template)",
  "purpose": "Prototype packaging of recommendations aimed at ASCE leaders for building IT-enabled knowledge governance, attribution, and compensation.",
  "manifests": [
    "cid:example_manifest_sha256_001"
  ],
  "governance": {
    "domain": "civil engineering professional-society knowledge",
    "stewardship": "Designated society governance bodies and committees",
    "verification_required": true,
    "verification_tier": "draft"
  },
  "attribution": {
    "attribution_required": true,
    "attribution_fields": [
      "author",
      "organization",
      "published_date",
      "citation",
      "license"
    ],
    "compensation_model_hint": "Prototype: route usage logs to a compensation ledger after human review."
  },
  "policy_gates": [
    {
      "gate_id": "gate_access_001",
      "gate_type": "access_control",
      "rule": "Member-only access for draft content.",
      "enforcement": "require_human_review"
    },
    {
      "gate_id": "gate_license_001",
      "gate_type": "licensing",
      "rule": "Restrict commercial reuse unless licensed.",
      "enforcement": "warn"
    },
    {
      "gate_id": "gate_quality_001",
      "gate_type": "quality",
      "rule": "Do not cite draft content as validated guidance.",
      "enforcement": "warn"
    }
  ]
}